name,price,status,shipping,free_returns,items_sold
Family Guy the complete series DVD collection season --- 20 DVD  us region 1,1999,Brand New,0,False,54
"Family Guy, Vol. 2: Season 3 - DVD - VERY GOOD",364,Pre-Owned,0,True,
"Family Guy, Volume Four - DVD - VERY GOOD",407,Pre-Owned,0,True,
"Family Guy Presents Stewie Griffin: The Untold Story (DVD, 2005, Unrated)",333,Pre-Owned,0,False,
Family Guy The Newest Season20 for 2022 DVD Box Set,1258,Brand New,0,False,178
Family Guy: Partial Terms of Endearment DVD,550,Pre-Owned,0,True,
"Family Guy: The Freakin' Sweet Collection (DVD, 2004)",99,Pre-Owned,399,True,
Family Guy: Volume One DVD,365,Pre-Owned,0,True,
Family Guy Complete Series Collection Season 1-18 DVD  Free shipping,6399,Brand New,0,False,61
Family Guy Death Action Figure Hooded Variant Series 2 Mezco,2000,Pre-Owned,995,False,
Family Guy Volume 3: Season 4 (DVD),199,Brand New,416,False,
Family Guy: Blue Harvest - DVD Includes Digital Copy Disc,650,Pre-Owned,0,False,
"Family Guy, Volume Three - DVD - VERY GOOD",364,Pre-Owned,0,True,
"Family Guy, Volume Five - DVD By Seth MacFarlane - GOOD",378,Pre-Owned,0,True,
"Family Guy, Volume One - DVD By Seth MacFarlane - VERY GOOD",366,Pre-Owned,0,True,
Family Guy Season 1-20 DVD The Complete Series 64-Disc Boxed Set Free Shipping,8563,Brand New,0,False,12
Family Guy: Volume Two DVD,365,Pre-Owned,0,True,
FAMILY GUY: SEASON 17 NEW DVD (STILL SEALED) (2018),1250,Brand New,349,False,
"Family Guy, Volume Six DVD",542,Pre-Owned,0,True,
"Family Guy: Season 16 [New DVD] Ac-3/Dolby Digital, Dolby, Dubbed, Subtitled,",1218,Brand New,0,True,
"Family Guy, Volume Eight DVD",533,Pre-Owned,0,True,
The Family Guy Star Wars Trilogy (DVD),999,Brand New,349,False,
"Family Guy, Volume Eight - DVD By Family Guy - GOOD",468,Pre-Owned,0,True,
Family Guy Complete 14th Season 14 Fourteen BRAND NEW 3-DISC DVD SET Sealed,2700,Brand New,349,False,
"Family Guy Volumes 1 and 2 (Seasons 1-3) DVD, Seth MacFarlane",400,Pre-Owned,416,False,
"Family Guy (Sony PlayStation 2, PS2 2006) Black Label Disk Case No Manual",1299,Pre-Owned,0,False,
FAMILY GUY: SEASON 17 NEW DVD,1588,Brand New,0,False,49
Family Guy: Part 2: Volumes 6-10 (DVD),499,Pre-Owned,416,False,
Family Guy Bendables 6 Piece Poseable Figures Complete Set ,2499,Pre-Owned,2605,False,
"DVD Sale, Pick Choose Your Movies, Combined Ship Huge Used Lot, A+ Movie Titles",100,Pre-Owned,395,True,
Family Guy Presents Blue Harvest - DVD - VERY GOOD,359,Pre-Owned,0,True,
Family Guy Season 11 DVD,648,Pre-Owned,0,True,
"Family Guy: Volume 5 Five (DVD, 2007, 3-Disc Set) NEW",597,Brand New,0,True,
Family Guy: Blue Harvest (DVD),1999,Pre-Owned,600,False,
Family Guy DVD Lot,975,Pre-Owned,0,False,
 POSTER -TV: CARTOON: FAMILY GUY - GROUP POSE-FREE SHIP  #3840   RAP14 A,1597,Brand New,0,False,
Family Guy Season 1-19 DVD Complete Series Set New Sealed,7388,Brand New,0,False,
"Family Guy, Volume Five DVD",548,Pre-Owned,0,True,
Family Guy: Partial Terms of Endearment DVDs,598,Pre-Owned,0,True,
Family Guy Sony PlayStation 2 PS2 Disc Only Tested And Working,1499,Pre-Owned,0,False,
Family Guy:  Seasons 1-20 The Complete Series(64-Discs) DVD Box Set Brand New,8579,Brand New,0,False,
"Family Guy, Volume Seven DVD",498,Pre-Owned,0,True,
family guy season seventeen dvd New See Details,999,Brand New,0,False,
"Stewie Griffin Family Guy 8"" Plush Stuffed Soft Toy Nanco 2004",750,Pre-Owned,399,True,
DVD Lot FAMILY GUY Volume 2 3 4 5 6 7 + Blue Harvest + Robot Chicken FREE SHIP!,2500,Brand New,0,False,
Family Guy Season Twelve - DVD By Mike Henry - GOOD,544,Pre-Owned,0,True,
"Family Guy  "" Merry Freakin Christmas "" Beer Glass w/ Stewie & Brian - Unused",949,Brand New,1061,False,
FAMILY GUY - The Freakin Sweet Collection (DVD) NEW SEALED ((FREE SHIPPING)),699,Brand New,0,False,
"Family Guy: Freakin Sweet Collection - Best of (DVD, 2004)",260,Pre-Owned,349,False,
Stern Family Guy Pinball Machine Lois Figure Modified 511-5050-00 NOS! Free Ship,1999,Brand New,0,True,
"Family Guy Presents Blue Harvest (DVD, Standard Edition)",330,New (Other),349,False,
"Family Guy Volume 2: Season 3 (DVD, 2000)",950,Pre-Owned,349,False,
Family Guy Presents: Blue Harvest (Blu-ray),299,New (Other),349,False,
"Family Guy ""The Freakin' Sweet Collection"" PSP UMD VIDEO DISK ONLY",1,Pre-Owned,349,False,
New SEALED 2005 Mezco Family Guy Lethal Lois Series 4 MOC,999,Brand New,589,True,
SEALED 2007 Mezco Family Guy Neil Goldman Variant Series 7 Upside Down? READ!,1499,Brand New,589,True,
Family Guy Presents - Stewie Griffin: The Untold Story - DVD - VERY GOOD,359,Pre-Owned,0,True,
Family Guy: It's A Trap! [Blu-ray/ DVD + Digital Copy],1,Pre-Owned,399,False,
Family Guy Volume 3: Season 4 (DVD),99,Pre-Owned,349,False,
"Family Guy (Sony PlayStation 2, 2006)",1570,New (Other),600,False,
FAMILY GUY - The Complete Thirteenth 13 Thirteen Season DVD,1195,Pre-Owned,0,True,
K’Nex Family Guy Peter and Station Wagon Building Set,799,Brand New,1190,False,
Family Guy dvd lot of 7,2500,Pre-Owned,0,False,
"Family Guy - The Freakin Sweet Collection (DVD, 2004)",99,Pre-Owned,600,False,
"Family Guy Volume 1: Seasons 1 & 2 (DVD, 1999)",500,New (Other),500,False,
"Family Guy, Volume Six - DVD - GOOD",482,Pre-Owned,0,True,
Family Guy Two-Pack (DVD),99,Pre-Owned,349,False,
"Family Guy - The Freakin Sweet Collection Spotlight Series (DVD, 2004)",299,Pre-Owned,349,False,
Family Guy: It's a Trap! (DVD),500,Pre-Owned,349,False,
Family Guy Video Game PS2 PlayStation 2 CIB TESTED AUTHENTIC WORKING,1400,Pre-Owned,610,False,
Family Guy VIDEO GAME  PSP Complete with case and manual Tested and working! CIB,2498,Pre-Owned,0,True,
Family Guy Season 16 Sixteen DVD 2017,450,Pre-Owned,400,True,
"Family Guy Presents Stewie Griffin: Untold Story (DVD, 2005)",499,Pre-Owned,0,False,
Family Guy Brian Pin,899,Brand New,560,False,
Vintage Original Family Guy Family Fever T-Shirt Size XL,1500,,699,False,
Vintage Original Family Guy Family Fever T-Shirt Size XL,1500,,699,False,
"Even At My Lois I Was Still A Family Guy T-Shirt, Even At My Lois Shirt KL1947",1614,Brand New,0,False,
"Family Guy: Something, Something, Something, Darkside - DVD - VERY GOOD",398,Pre-Owned,0,True,
"Family Guy (Sony PlayStation 2, 2006)",1500,Pre-Owned,560,False,
Family Guy Video Game PS2 PlayStation 2 CIB TESTED AUTHENTIC WORKING,1400,Pre-Owned,610,False,
Family Guy VIDEO GAME  PSP Complete with case and manual Tested and working! CIB,2498,Pre-Owned,0,True,
"Family Guy Presents Stewie Griffin: Untold Story (DVD, 2005)",499,Pre-Owned,0,False,
The Family Guy: Volume 6 (DVD),349,Pre-Owned,349,False,
FAMILY GUY - Volume Season 10 Ten - DVD,699,Pre-Owned,0,True,
Family guy dvd lot Volumes 1 - 7,1490,New (Other),617,False,
"Family Guy (Microsoft Xbox, 2006) NO MANUAL",1699,Pre-Owned,499,False,
"Family Guy (Sony PlayStation 2, 2006) CIB",1499,Pre-Owned,0,False,
Family Guy Season 11 (DVD),99,New (Other),349,False,
Family Guy Peter Lois Meg Stewie Brian Series Characters ID Holder Lanyard,499,Brand New,400,False,
Comedy DVD Sale Lot Classic Funny Humor Movie Combined Shipping CHEAP ,100,Pre-Owned,395,True,
New SEALED 2005 Mezco Family Guy Mutant Stewie Series 2 MOC,999,Brand New,589,True,
"Family Guy, Volume Four DVD",495,Pre-Owned,0,True,
Family Guy Bundle,420,Pre-Owned,610,False,
Jumbo Brian Griffin Family Guy Dog Stuffed Plush Doll Toy Factory 24” Large,3700,Pre-Owned,0,False,
Family Guy Season 16 DVD Set 3 Discs Pre-Owned,500,New (Other),349,False,
Stern Family Guy Pinball Machine Lois Figure Modified 511-5050-00 NOS! Free Ship,1999,Brand New,0,True,
"FAMILY GUY: Volume Seven (2009, Fox)  3-Disc DVD Set!",799,Pre-Owned,0,False,
Family Guy Autograph Card A4 Mike Henry as Cleveland Brown,3499,Pre-Owned,0,True,
"Family Guy Volume 2: Season 3 (DVD, 2000)",349,Pre-Owned,349,False,
"Family Guy - Volume 2: Season 3 (DVD, 2003, 3-Disc Set) NEW",537,Brand New,0,True,
"Family Guy Presents Blue Harvest (DVD, 2009, Standard Edition)",99,Pre-Owned,550,False,
Family Guy Episode IV A New Hope Evil Empire CL1 Case Loader Insert,1699,Pre-Owned,0,True,
Family Guy K’nex Series 1 Figures Lot Of 5 Different Coded Blind Bags NEW,1200,Brand New,0,False,
Stern Family Guy Pinball Machine Meg Figure Modified 880-5084-01-01 NOS!,1999,Brand New,0,True,
Family Guy Dvd Seasons 1-7,1800,Pre-Owned,349,False,
New SEALED 2005 Mezco Family Guy Mort Goldman Series 4 MOC,999,Brand New,589,True,
Stern Family Guy Pinball Machine Brian Figure Modified 880-5084-00-01 NOS!,1999,Brand New,0,True,
Family Guy Disc 4 Season 2 Episodes 15-21,349,Pre-Owned,449,False,
Family Guy Volume 4: Season 4 (DVD),399,Pre-Owned,349,False,
"Family Guy: It's a Trap! (DVD, includes Digital Copy, 2010)",500,New (Other),349,False,
"Family Guy, Volume Five - DVD By Seth MacFarlane - VERY GOOD",378,Pre-Owned,0,True,
"Family Guy PS2 (Sony PlayStation 2, 2006) Complete CIB TESTED W/manual",1999,Pre-Owned,0,False,
"The Family Guy DVD Stewie Griffin, the Untold Story",99,New (Other),350,False,
Family Guy and Philosophy: A Cure for the Petarded (The Blackwell Philoso - GOOD,403,Pre-Owned,0,True,
"Family Guy Presents Stewie Griffin: Untold Story (DVD, 2005)",733,Brand New,0,True,
"Family Guy  "" Someone's Been Naughty "" Sexy Christmas Beer Glass - Unused",949,Brand New,1061,False,
Funko Family Guy Chris Bobble-Head (item B),499,Brand New,499,False,
The Family Guy Star Wars Trilogy (Blu-ray) Laugh it up Fuzzball,1299,Pre-Owned,0,True,
Family Guy Partial Terms of Endearment DVD,700,Pre-Owned,0,False,
"Family Guy: Its a Trap (Blu-ray Disc, 2010, 2-Disc Set) USED",500,Pre-Owned,349,False,
Family Guy: Partial Terms of Endearment (DVD) Banned From TV!,495,Pre-Owned,0,False,
Family Guy Autograph Card A5 Lois Alan as Diane Simmons,1999,Pre-Owned,0,True,
Family Guy Star Wars DVD Trilogy Lot,3000,Pre-Owned,800,False,
Family Guy Stewing Plush Toy,1000,Pre-Owned,1060,False,
Family Guy Lot of 4 DVD Sets,600,New (Other),416,False,
Family Guy Season 17 DVD Set 3 Discs Pre-Owned,500,New (Other),349,False,
Family Guy Two-Pack (DVD),1000,New (Other),416,False,
SEALED 2007 Mezco Family Guy Neil Goldman Variant Series 7 MOC,999,Brand New,589,True,
"Family Guy, Partial Terms Of Endearment. DVD",347,Pre-Owned,444,False,
Family Guy Christmas Ornament Brian Dog w/ Drink Fox Santa Holiday Resin MIP,750,,590,False,
Stern Family Guy Pinball Machine Peter Figure Modified 511-5005-00 NOS Free Ship,2999,Brand New,0,True,
Family Guy Volume Four 3 Dvd Set 2006,99,New (Other),349,False,
Family Guy Season 3 Disc 3 - **Replacement DISC ONLY WITH TRACKING**,292,Pre-Owned,0,False,
Family Guy: It's a Trap! (DVD),99,Pre-Owned,349,False,
Family Guy: Presents Stewie Griffin: The Untold Story DVD **DISC ONLY** ,235,Pre-Owned,0,False,
Family Guy: The Freakin' Sweet Collection (DVD),300,Pre-Owned,0,False,
Family Guy Seasons 1 & 2 - Partial Seasons,525,Pre-Owned,349,False,
"Family Guy VOLUMES 1-12 + 13,14, & 15 Dvd VOLUMES Lot Of 16",16000,Pre-Owned,1500,False,
Family Guy: It's a Trap! (DVD),99,Pre-Owned,349,False,
The Family Guy: Volume 7 (DVD),99,New (Other),349,False,
New SEALED 2007 Mezco Family Guy Neil Goldman Green Shirt Series 7 MOC,999,Brand New,589,True,
Family Guy: It's A Trap! - DVD By Carrie Fisher - VERY GOOD,359,Pre-Owned,0,True,
"Family Guy: Season 11, Volume 12",799,New (Other),349,False,
The Family Guy Star Wars Trilogy (Blu-ray) Laugh it up Fuzzball,1044,Pre-Owned,349,False,
"Family Guy: Something, Something, Something, Darkside",499,Pre-Owned,0,False,
"Used Family Guy - The Freakin Sweet Collection (DVD, 2004)",1965,Pre-Owned,0,True,
Family Guy Blue Harvest (DVD),360,New (Other),349,False,
Family guy big lot,2000,Pre-Owned,416,False,
"Family Guy Volume 1: Seasons 1 & 2 (DVD, 1999)",500,Pre-Owned,349,False,
Stern Family Guy Pinball Machine Chris Figure Modified 511-5006-00 NOS Free Ship,2999,Brand New,0,True,
YOU PICK / CHOOSE DVD BOX SETS TV COMPLETE SEASONS COMBINED SHIPPING $4.00 +Ship,400,Pre-Owned,300,False,
"Family Guy, Vol. 1: Seasons 1 & 2 (4 Discs)",300,Pre-Owned,0,False,
Family Guy Two-Pack (DVD),700,Brand New,349,False,
"Family Guy, Vol. 2: Season 3 [3 Discs]",300,Pre-Owned,0,False,
Family Guy Christmas Ho-Ho-Holy Crap! DVD - Brand New - Sealed!,1199,Brand New,0,False,
The Official Family Guy Drinking Game Pint Glass,299,Pre-Owned,943,False,
"CLEVELAND BROWN 6"" FAMILY GUY FIGURE Series 2 ~ Mezco ~ TV Cartoon",895,Pre-Owned,1260,False,
"Family Guy - Volume 1: Seasons 1  2 (DVD, 4-Disc Set)",73,New (Other),739,False,
"Family Guy: Season 13 (DVD, 2014) Missing Disc 3",599,Pre-Owned,0,True,
Family Guy Presents Stewie Griffin: The Untold Story (DVD),300,Pre-Owned,0,False,
#33 Holiday Halloween Christmas DVD LOT PICK & CHOOSE $4 Flat Combined Shipping,200,Pre-Owned,400,False,
Buffalo Bills X Family Guy Die Cut Stickers 3.5”X 3.5” Pop Art 90s Stewie,495,Brand New,0,False,
"Family Guy - Volume 7 - Big Fat Peter Collector's Pack, (DVD, 2009, 3-Disc Set)",1295,Pre-Owned,350,False,
Family Guy Seasons 5 DVD,450,New (Other),349,False,
Family Guy Season One trading card lot promos P1 P3 Bad Dog BD1 Inkworks 2005,99,,379,True,
"Family Guy Presents Blue Harvest (DVD, Standard Edition)",99,New (Other),349,False,
"Family Guy: Partial Terms of Endearment (DVD, 2010) w/ Slipcover",500,Pre-Owned,349,False,
"Family Guy Volume 2: Season 3 (DVD, 2000)",800,Pre-Owned,500,False,
Family Guy Volume 4: Season 4 (DVD) Disc 3,300,Pre-Owned,0,False,
Family Guy Volumes 1-3 DVD Bundle Collection,299,Pre-Owned,416,False,
"Family Guy, Vol. 5 (3 Discs) (dvd_video)",300,Pre-Owned,0,False,
Family Guy: Volume Four (DVD),300,Pre-Owned,0,False,
Family Guy: Partial Terms of Endearment (DVD),1125,Pre-Owned,399,True,
Family Guy - The Freakin' Sweet Collection  Seth MacFarlane,539,Pre-Owned,375,True,
Brian Family Guy Funko #32 NoBox,2000,Pre-Owned,0,False,
"Family Guy: Part 3: Seasons 10-14 [New DVD] Dolby, Subtitled, Widescreen",2470,Brand New,0,True,
"FAMILY GUY VOLUME THREE - 3-Disc Set - Peter, Lois, Meg, Chris, Stewie, Brian",75,New (Other),450,False,
"DVD: ""Family Guy: Vol. 2, Season 3"" full screen DVD (22 episodes)",400,New (Other),425,False,
"DVD Sale Pick Choose Your Movies Lot Over 300 Top A+ Titles, BUY MORE AND SAVE",100,Pre-Owned,395,True,
Family Guy: Season 11 [DVD][Region A/1] NEW,999,Brand New,0,False,
"Family Guy Presents Stewie Griffin: The Untold Story (DVD, 2005, Unrated)",99,Pre-Owned,349,False,
Family Guy: Part 3: Seasons 10-14 (DVD),1999,Pre-Owned,349,False,
"Family Guy: Part 2: Volumes 6-10 [New DVD] Full Frame, Subtitled, Dolby",2414,Brand New,0,True,
Family Guy Season 14,886,Pre-Owned,0,False,
"Family Guy, Volume Seven DVD",529,Pre-Owned,0,True,
Family Guy DVD Presents Blue Harvest 2009 Standard Edition Partially Sealed,325,New (Other),349,False,
Family Guy - Volume 4 (DVD),525,Pre-Owned,0,False,
"Family Guy: Volume 7 (3DVD, 2009) w/ Slipcover",500,Pre-Owned,349,False,
"Family Guy: Season 14 (DVD, 2015)",1000,Pre-Owned,349,False,
Family Guy: Season Fifteen 15 Out Of Print 3-Disc DVD,2495,Pre-Owned,400,False,
"Family Guy Presents Stewie Griffin: Untold Story (DVD, 2005)",99,Pre-Owned,349,True,
Family Guy - Volume Five DVD Set NEW SEALED LOW SHIP!!,299,Brand New,416,False,
Build Your Dvd Collection U PICK $.99 DVD MOVIE cheap!,99,Pre-Owned,99,False,
Family Guy: It's A Trap! [Blu-ray/ DVD + Digital Copy],599,Pre-Owned,0,True,
"Family Guy - Volume 5 (DVD, 2007, 3-Disc Set)",99,Pre-Owned,349,True,
"Family Guy: Blue Harvest (DVD, Box Set)",499,Pre-Owned,416,False,
FAMILY GUY SEASON ONE DISC ONE  EPISODES 1 - 7  (dvd) **********disc only******,249,Pre-Owned,0,False,
"Family Guy: Season 13 (3DVD, 2014) w/ Slipcover",1000,Pre-Owned,349,False,
Family Guy: It's A Trap! B1,499,Pre-Owned,0,False,
"Family Guy Volume 2: Season 3 (DVD, 2000)",605,Brand New,0,False,
Family Guy: Blue Harvest - DVD - VERY GOOD,595,Pre-Owned,0,False,
Family Guy South Park Futurama Simpson Movie Lot,999,Pre-Owned,795,False,
Family Guy FYC Emmy Consideration Promo DVD 2 Episodes Screener 2013,1195,Pre-Owned,0,False,
Family Guy Blue Harvest (DVD),310,Pre-Owned,349,False,
"Family Guy: Season 11, Volume 12",649,Pre-Owned,0,False,
"Family Guy: Season 12 (3DVD, 2014) w/ Slipcover",1000,Pre-Owned,349,False,
A Very Special Freakin Family Guy Christmas (DVD),325,Pre-Owned,399,True,
The Family Guy: Volume 7 (DVD) Disc 1 Episodes 1-5,499,Brand New,0,True,
Family Guy Volume 6 Disc 3 - **Replacement DISC ONLY WITH TRACKING**,292,Pre-Owned,0,False,
"Family Guy: Season 10 - DVD - Replacement Discs #1, or #3",314,Pre-Owned,375,True,
Family Guy: It's A Trap!  Seth MacFarlane,359,Pre-Owned,375,True,
"Family Guy, Volume Seven - 3 Disc DVD Set - Seth MacFarlane",449,Pre-Owned,375,True,
Family Guy - The Freakin' Sweet Collection,599,Pre-Owned,0,True,
"Family Guy, Volume Four - Replacement Disc #1 or #2",314,Pre-Owned,375,True,
FAMILY GUY SEASON 1 DISC 1 EPISODES 1 THROUGH 7 DISC ONLY ONLY,359,Pre-Owned,375,True,
Family Guy - The Freakin' Sweet Collection DVD (AMAZING DVD IN PERFECT CONDITION,460,New (Other),0,True,
Family Guy Presents Stewie Griffin The Untold Story DVD 2005 Brand NEW Sealed,199,Brand New,349,True,
"Family Guy: Part 3: Seasons 10-14 [New DVD] Dolby, Subtitled, Widescreen",2399,Brand New,0,False,
"Family Guy - Volume 2: Season 3 (DVD, 2003, 3-Disc Set) NEW",675,Brand New,0,True,
Family Guy: Freakin' Sweet Party Pack The Complete Collection [DVD] NEW SEALED,4999,Brand New,550,False,
"Family Guy Volume 2: Season 3 (DVD, 2000)",99,New (Other),349,False,
"Family Guy Presents Blue Harvest (DVD, Standard Edition)",499,New (Other),0,False,
FAMILY GUY PRESENTS BLUE HARVEST USED DVD,99,Pre-Owned,400,False,
"Family Guy - Volume 2: Season 3 & Vol 3 (DVD, 2003, 6-Disc Set)",199,Pre-Owned,500,True,
"Lot of Family Guy TV Volumes 1, 3 & 4 DVD Seth MacFarlane",850,Pre-Owned,416,True,
Lot of Family Guy - Volumes- 1 through 6 (DVDS+3 BONUS DVDS FREE SHIP,3834,New (Other),0,False,
Family Guy Volume 4: 3 Disc Set (DVD) ,539,Pre-Owned,375,True,
"Family Guy, Volume Nine [DVD]",524,Pre-Owned,0,False,
Family Guy Volume 3: Season 4 (DVD) Disc 1 B1,499,New (Other),0,False,
Family Guy Volume 4: Season 4 (DVD) Brand New! Sealed!,640,Brand New,0,False,
Family Guy: It's A Trap! - DVD By Carrie Fisher - VERY GOOD,595,Pre-Owned,0,False,
"Family Guy Volume 1: Seasons 1 & 2 (DVD, 1999)",750,Pre-Owned,0,False,
"Family Guy - The Freakin' Sweet Collection (DVD, 2004)",200,Pre-Owned,349,False,
Family Guy Volume Five DVD Limited Edition Collectors 3 Disc Set 2007 Target NEW,2288,Brand New,0,False,
"Family Guy Volume 4: Season 4 (DVD 3-Disc Set, 2006) - New Factory Sealed",500,Pre-Owned,349,False,
Family Guy: It's a Trap! (DVD) **Buy 4 Get 10 Free!**,500,Pre-Owned,0,False,
Family Guy: Season 10 - Vol. 11 (DVD),680,Pre-Owned,0,True,
Family Guy LOT of 4 DVDs,499,Pre-Owned,450,False,
"Family Guy Volume One, Seasons 1 & 2    4-Disc DVD  -  All 28 Episodes",499,Pre-Owned,349,False,
Family Guy | Volume 5 | DVD | 2007 | 3-Disc Set | ,449,Pre-Owned,375,True,
"Family Guy Presents Stewie Griffin: Untold Story (DVD, 2005)",623,Pre-Owned,943,True,
"Family Guy - Volume 1: Seasons 1 & 2 (DVD, 2004, 4-Disc Set)",1998,New (Other),645,True,
Family Guy Season 1 DVD Region 4 PAL Free Postage,512,Pre-Owned,2433,False,
Family Guy: Partial Terms of Endearment (DVD) BANNED FROM T V NEW SEALED,1200,Brand New,0,False,
"Family Guy : Season 3 (DVD, 2001)",64,Pre-Owned,1284,False,
FAMILY GUY PRESENTS BLUE HARVEST USED DVD,99,Pre-Owned,400,False,
The Dark Knight Trilogy DVD Box Set & Family Guy Volume One Season 1-2 - DVD Lot,1800,Pre-Owned,0,False,
The Family Guy Star Wars Trilogy (Blu-ray),1500,Pre-Owned,0,False,
The Family Guy - Volume 2 Season 3  -  *DVD*,599,Pre-Owned,0,True,
Family Guy Season 6 DVD Region 4 PAL Free Postage,512,Pre-Owned,2433,False,
"DVD : Family  Guy,  Blue Harvast free shipping ",1210,New (Other),0,False,
Family Guy Volume 4: Season 4 (DVD),99,Pre-Owned,399,False,
Family Guy Seasons 1-4 DVD Box Sets ,999,Pre-Owned,550,False,
Family Guy - Volume 8 | DVD | 2009 | Resurfaced,371,Pre-Owned,349,True,
"Family Guy Presents Stewie Griffin: The Untold Story (DVD, 2005, Uncensored)",399,New (Other),349,True,
"Family Guy: Part 1: Volumes 1-5 (DVD, 16-Disc Set) ~Brand New~",2500,Brand New,470,False,
"Family Guy: Something, Something, Something Darkside (DVD, 2009) NEW",587,Brand New,0,True,
"Family Guy Presents Stewie Griffin: The Untold Story (DVD, 2005, Uncensored)",988,Pre-Owned,349,False,
"Family Guy Volume 1: Seasons 1 & 2 (DVD, 1999) 28 Episode Lot",99,New (Other),575,False,
"Family Guy Presents Stewie Griffin: Untold Story (DVD, 2005)",399,New (Other),349,False,
Family Guy  DVD Volume 5 Disc 1 Episodes 1-6 Replacement Disc,539,Pre-Owned,349,True,
"Family Guy: Volume 9 (3DVD, 2011) w/ Slipcover",500,Pre-Owned,349,False,
"Family Guy: Volume 8 (4DVD, 2010) w/ Slipcover",500,Pre-Owned,349,False,
Family Guy Season Fifteen 15 (DVD 2017) animated comedy Seth McFarlane SLIPCOVER,2999,Pre-Owned,300,False,
"Family Guy: Its a Trap (DVD, 2010) New",629,Brand New,0,False,
"Family Guy: Season 12 [New DVD] 3 Pack, Ac-3/Dolby Digital, Dolby, Subtitled,",1792,Brand New,0,True,
Family Guy  DVD Volume 5 Disc 3 Special Features Replacement Disc,539,Pre-Owned,349,True,
Family Guy: Presents Blue Harvest (2 DVD Set) 2007 with Special Features,600,Pre-Owned,349,False,
The Family Guy Star Wars Trilogy (Blu-ray) Used,590,New (Other),349,False,
"Family Guy: Volume 4 (3DVD, 2006)",500,Pre-Owned,349,False,
Family Guy: Partial Terms of Endearment (DVD),425,Pre-Owned,349,False,
"Family Guy Volume 2: Season 3 (DVD, 2000)",499,New (Other),0,False,
The Family Guy Trilogy (DVD) - New Old Stock - Factory Sealed,1500,Brand New,349,False,
"Family Guy: Partial Terms of Endearment (2010, DVD) Banned From TV - Free Ship!",595,Pre-Owned,0,False,
Family Guy: Presents Blue Harvest (2 DVD Set) 2007 with Special Features,1000,Pre-Owned,459,False,
BRAND NEW DVDs (Listing 2 of 3) **SAVE BIG ON BUNDLE & SHIPPING DISCOUNTS**,150,Brand New,349,False,
"Family Guy Presents - Stewie Griffin: The Untold Story (DVD, 2005)",499,New (Other),0,True,
"Family Guy, Vol. 10 (3DVD, 2012) w/ Slipcover",1000,Pre-Owned,349,False,
Family Guy: Blue Harvest - DVD  2 disc set,200,New (Other),349,False,
Family Guy: Part 1: Volumes 1-5 (DVD) Complete comedy TV series 16 discs,900,New (Other),1505,False,
Family Guy Volume 3: Season 4 (DVD),99,Pre-Owned,349,True,
Family Guy 1-17 Cleveland Show 1&2 DVD Lot Partial Terms of Endearment Stewie...,19995,New (Other),2000,False,
Lot of 10 FAMILY GUY DVD sets - Vols 1-10 All complete Free Shipping,4099,Pre-Owned,0,False,
"Family Guy: Blue Harvest (DVD) 2 Disc Set, Star Wars Spoof",500,New (Other),500,False,
Lot of 30 DVDs (8 Box Sets) Entourage Family Guy Get Smart Kids In Hall Brady B.,2399,Pre-Owned,751,False,
"Family Guy Presents Blue Harvest (DVD, Standard Edition)",300,Pre-Owned,349,True,
